text,intent,maturity_score,entities,category,metadata
"Journal of Management Studies published by Society for the Advancement of Management 
Studies and John Wiley & Sons Ltd
A Systematic Review of the Literature on Digital 
Transformation: Insights and Implications for 
Strategy and Organizational Change
André Hanelta, René Bohnsackb,*, David Marzc and 
Cláudia Antunes Maranteb
a University of  Kassel; b Católica Lisbon School of  Business & Economics; c University of  Goettingen
ABSTRACT  In this article we provide a systematic review of the extensive yet diverse and frag-
mented literature on digital transformation (DT), with the goal of clarifying boundary condi-
tions to investigate the phenomenon from the perspective of organizational change.",outros,1,,banco,
"On the 
basis of 279 articles, we provide a multi-dimensional framework synthesizing what is known 
about DT and discern two important thematical patterns: DT is moving firms to malleable 
organizational designs that enable continuous adaptation, and this move is embedded in and 
driven by digital business ecosystems.",outros,1,,banco,
"From these two patterns, we derive four perspectives on 
the phenomenon of DT: technology impact, compartmentalized adaptation, systemic shift and 
holistic co-evolution.",outros,1,,banco,
"Linking our findings and interpretations to existing work, we find that the 
nature of DT is only partially covered by conventional frameworks on organizational change.",outros,1,,banco,
"On the basis of this analysis, we derive a research agenda and provide managerial implications 
for strategy and organizational change.",outros,1,,banco,
"Keywords: digital business ecosystems, digital transformation, organizational change, 
organizational designs, systematic literature review
INTRODUCTION
Digital transformation (DT) is increasingly establishing itself as a constant theme in con-
temporary academic and practitioner conversations.",outros,1,,banco,
"Therefore, the phenomenon is naturally con-
nected to the topic of  organizational change, viewed as a ‘difference in form, quality, 
or state over time in an organizational entity’ (Van de Ven and Poole, 1995, p. 512).",outros,1,,banco,
"Thus, we define DT as organizational change that is triggered and shaped by the wide-
spread diffusion of  digital technologies.",outros,1,,banco,
"Such a view enables us to potentially explain 
the phenomenon of  DT and its management in business practice by drawing on the 
robust and diversified knowledge base relating to organizational change and innova-
tion (Poole and Van de Ven, 2004).",inteligencia_artificial,1,,banco,
"While prior research studied organizational change in relation to information 
technology (IT) (Markus and Robey, 1988; Orlikowski, 2000; Volkoff et al., 2007), the 
latter defined as ‘computer-based technology for the storage, accessing, processing and 
communication of information’ (Molloy and Schwenk, 1995, p. 283), and created valu-
able and persistent knowledge, recent observations suggest that DT deviates from these 
past organizational changes in at least the following ways.",outros,1,,banco,
"First, the technologies in-
volved, such as big data analytics, social media, mobile technology or cloud computing, 
seem very different from earlier IT (Bharadwaj et al., 2013).",infraestrutura_digital,4,,banco,
"Third, the consequences 
of DT – such as the emergence of new digital business models even in non-digital in-
dustries – seem to extend beyond those of previous phases of IT-enabled change, which 
were usually related to the practice level and rather incremental change within firms 
 14676486, 2021, 5, Downloaded from https://onlinelibrary.wiley.com/doi/10.1111/joms.12639 by Capes, Wiley Online Library on [30/04/2025].",outros,1,,banco,
"In summary and as indicated by recent works (e.g., Wessel et al., 
2020), it seems that the phenomenon of DT differs from past IT-related organizational 
change and cannot, therefore, be explained entirely using established theoretical models 
(Markus and Rowe, 2018).",inteligencia_artificial,1,,banco,
"Instead, DT seems to have a more intricate and encompass-
ing connection to the topic of organizational change, requiring a broader view of and 
comparison with the literature on organizational change and innovation (Poole and Van 
de Ven, 2004).",outros,1,,banco,
"Due to the uncertainties about the phenomenon, it is currently unclear whether, and if 
so how knowledge on organizational change can be used to explain DT.",inteligencia_artificial,1,,banco,
"In other words, 
as the boundaries of the phenomenon are unclear, we cannot be sure whether DT is cov-
ered by existing knowledge of organizational change.",outros,1,,banco,
"And, how does DT relate 
to existing knowledge on organizational change?",outros,1,,banco,
"Accordingly, we aim to clarify the boundary conditions both phenomenologi-
cally and inductively (Post et al., 2020).",inteligencia_artificial,1,,banco,
"Second, this shift is embedded in and driven by digital business ecosystems.",outros,1,,banco,
"By connect-
ing these content patterns with the dimensions of context and process (Pettigrew, 1987), 
we derived four perspectives on DT: technology impact, compartmentalized adaptation, 
systemic shift and holistic co-evolution.",outros,1,,banco,
"Thus, 
we relate our findings particularly to the distinction in organizational change literature 
between episodic and continuous change perspectives, as this distinction is ‘sufficiently 
 14676486, 2021, 5, Downloaded from https://onlinelibrary.wiley.com/doi/10.1111/joms.12639 by Capes, Wiley Online Library on [30/04/2025].",outros,1,,banco,
"Whereas the episodic position relates to infrequent and 
intentional organizational change (Lewin, 1951; Poole and Van de Ven, 2004; Waeger 
and Weber, 2019), the continuous position assumes ‘ongoing, evolving and cumulative’ 
change (Weick and Quinn, 1999, p. 365).",outros,1,,banco,
"Finally, we derive a substan-
tial research agenda on the basis of our analysis of the fit between the phenomenon of 
DT and the established literature on organizational change and innovation.",outros,1,,banco,
"While there are multiple ways in which a literature review can make a theoretical 
contribution, this article aims to contribute via the clarification of boundary conditions, 
which is seen as critical for the advancement of research around a theory or topic (Post 
et al., 2020).",inteligencia_artificial,1,,banco,
"Third, we propose linkages between the phenomenon of DT and established views in 
management literature on organizational change and innovation and derive important 
avenues for future research.",outros,1,,banco,
"Overall, our review aims to help scholars to understand 
the phenomenon DT, encourage them to think differently about the phenomenon, and 
allow the development of novel and interesting empirical studies in subsequent research 
(Post et al., 2020).",inteligencia_artificial,1,,banco,
"Finally, our work aims to support managers to respond to the strategic 
challenge of DT (Singh et al., 2020) by revealing important insights on the shifts towards 
malleable organizational designs and digital business ecosystems that may inform orga-
nizational change and strategy practices.",inteligencia_artificial,1,,banco,
"We selected the year 2000 
as the baseline for our search in order to gain robust insights into recent developments 
in the understanding of DT.",inteligencia_artificial,1,,banco,
"The FT50 list contains high 
quality journals across a range of disciplines, such as the Journal of Management Studies 
or Organization Science, and was used as a representative and externally valid sample 
of top management journals (Biehl et al., 2006; Burgess and Shaw, 2010).",inteligencia_artificial,1,,banco,
"First, as is explained in more detail later on, it allowed us to cater to all 
four of the dimensions of organizational change, or ‘issues common to all change efforts’ 
(p. 293), named by Armenakis and Bedeian (1999), i.e., content, context, process and out-
comes (see explanation below).",inteligencia_artificial,1,,banco,
"An example of contextual conditions is the emergence and diffusion of cloud 
computing, as it is described as shaping and driving DT (e.g., Benlian et al., 2018).",infraestrutura_digital,4,,banco,
"In the 
category mechanisms we identified, for example, process models to describe and explain 
how small and medium enterprises drive DT in their companies (Li et al., 2017).",inteligencia_artificial,1,,banco,
"After applying the categories 
and sub-categories to about half the material, we again revised the category system 
by splitting up the sub-categories ‘into individual features or values’ (Mayring, 2014,  
p. 95).",inteligencia_artificial,1,,banco,
"For example, environmental antecedents were found to contain country charac-
teristics, industry characteristics and consumer characteristics.",inteligencia_artificial,1,,banco,
"Finally, the prevailing discrepancies were discussed and unified by all four authors until 
agreements were reached on the allocations of all the articles.",inteligencia_artificial,1,,banco,
"In the 
following section, we describe the findings of our review in detail.",inteligencia_artificial,1,,banco,
"We found that so-called SMACIT tech-
nologies (social, mobile, analytics, cloud, and Internet of Things) (e.g., Sebastian et al., 
Figure 1.",infraestrutura_digital,4,,banco,
"Concurrently, the emergence and diffusion of digital technologies 
has led to an increased data availability, which in turn has increased the importance for 
organizations of machine learning and data analytics (Weichert, 2017).",inteligencia_artificial,1,,banco,
"These include the legal and infrastructural conditions of a country, 
such as regulatory frameworks and interventions (e.g., Cortet et al., 2016), but also tech-
nology-driven industry dynamics, including, among other things, the changing technological 
landscape of an industry (e.g., Alos-Simo et al., 2017).",outros,1,,banco,
"Consumers increasingly rely on 
digital technologies in their daily routines and personal interactions (e.g., Brynjolfsson 
et al., 2013), and expect ubiquitous access to virtual resources (e.g., Benlian et al., 2018).",inteligencia_artificial,1,,banco,
"We identified two main mechanisms used by organizations 
to conceive and bring about DT: innovation and integration (Daniel and Wilson, 2003; 
Henfridsson and Yoo, 2013).",inteligencia_artificial,1,,banco,
"Mobilization for and acceleration of  digital transformation by TMTs 
is another critical activity at the strategic level, and is used, among other things, to attract 
a new generation of workers (e.g., Matzler et al., 2018) and to establish digital mindsets 
(e.g., Hansen et al., 2011).",outros,1,,banco,
"With a more operational focus but embedded in the strategic 
orientation, the exploitation and leveraging of  digital capabilities is important for organizations, 
mainly regarding online informational capabilities (Barua et al., 2004), big data analyt-
ics capabilities (e.g., Hausladen and Zipf, 2018) and digital platform capabilities (e.g., 
Karimi and Walter, 2015).",inteligencia_artificial,1,,banco,
"This also includes merging human-ma-
chine interaction as a core activity to establish value-adding and sustainable synergies be-
tween technology and humans (Bajer, 2017).",inteligencia_artificial,1,,banco,
"First, developing a digital transformation strategy that ‘serves as a cen-
tral concept to integrate the entire coordination, prioritization, and implementation of 
digital transformations within a firm’ (Matt et al., 2015, p. 339) is key to marshalling 
this integration in the course of DT.",outros,1,,banco,
"Executions of such plans involve activities to unlock 
organizations, for example by developing dynamic capabilities (e.g., Karimi and Walter, 
2015) and enhanced organizational learning abilities (e.g., Schuchmann and Seufert, 
2015).",outros,1,,banco,
"To start with, we 
found that a focus on open innovation and crowdsourcing leads to more ecosystem-oriented 
and -embedded organizations (Berman and Marshall, 2014).",outros,1,,banco,
"This shift continues in the in-
tra-organizational structuring: organizations develop permeable, agile organizational structures, 
and in doing so become agile, adaptable and boundaryless, as manifested in organiza-
tional forms such as Holacracy (e.g., Schwer and Hitz, 2018).",outros,1,,banco,
"This is evidenced by 
the increased use of artificial intelligence support and decision support systems (e.g., 
Kolbjørnsrud et al., 2016).",outros,1,,banco,
"In a similar vein, digital and customer experience-focused business 
models gain importance.",experiencia_cliente,3,,banco,
"Finally, DT in organizations culminates in the outcome of automatized, 
data-driven and virtual business processes through an enhanced use of digital technologies and 
software for performing tasks (e.g., Dery et al., 2017), as well as the development of smart, 
connected and customized products (e.g., Porter and Heppelman, 2015).",outros,1,,banco,
"These spill-overs – divided into paradigms, systems, industry, information secu-
rity and individual effects – form the environment with which firms interact to remain 
legitimate and successful.",inteligencia_artificial,1,,banco,
"DT thereby causes a blurring of  the 
boundaries between physical and online industry structures, including the convergence of physical 
products and digital services, merging the physical world with online content, and creat-
ing an omnichannel environment for the customer (e.g., Brynjolfsson et al., 2013).",experiencia_cliente,5,,banco,
"DISCUSSION OF FINDINGS
Although our findings portray DT as complex and diversified, we can abstract directions 
concerning the content of organizational change (Armenakis and Bedeian, 1999).",outros,1,,banco,
"In particular, 
we observe the move towards malleable organizational designs that are embedded in and 
driven by digital business ecosystems.",outros,1,,banco,
"(2017) say, in summary, that digital firms adapt rapidly though the mechanisms of 
data-driven operation (e.g., fine-grained monitoring and user profiling based on digital 
technologies), swift transformation (e.g., fast redefinition of core markets, identities and 
activities) and instant release (e.g., dynamic innovation of digital offerings based on cus-
tomer feedback).",inteligencia_artificial,1,,banco,
"For in-
stance, data-driven operations and decision making are underpinned by automatized, 
data-driven and virtual business processes, as well as technology-focused and -supported 
management.",outros,1,,banco,
"Finally, the outcomes of digital and customer experience-focused digital 
business models and of smart connected and customized products can be related to the 
mechanism of instant release, as these are dynamically adaptable and scalable market 
offerings.",experiencia_cliente,3,,banco,
"For instance, by engaging in digital innovation, 
new digital business models are established that allow for instant release.",outros,1,,banco,
"By building on 
new digital capabilities and human-machine interaction, data-driven operations can be 
achieved.",outros,1,,banco,
"Developing a digital business strategy, digital acceleration and digital mobiliza-
tion help to unfreeze the organization for swift transformation.",outros,1,,banco,
"Here digital firms and non-digital firms 
diverge, as the latter have to deal with a pre-existing organizational design, requiring a 
digital transformation strategy and physical-digital harmonizing, while digital firms are 
regularly built from scratch (Tumbas et al., 2017).",outros,1,,banco,
"Data-driven operations and decisions tune the firm to environmental feedback, 
for instance from customers, by utilizing the potential of AI and machine learning to 
automatically detect and react to changes.",inteligencia_artificial,1,,banco,
"This is termed ‘digital ecodynamics’, a 
phenomenon that ‘has no separations among its three core elements, but it is the whole-
ness of the fused interactions among the three elements’ (El Sawy et al., 2010, p. 837).",outros,1,,banco,
"Towards Digital Business Ecosystems
Drawing upon the manifold changes that our review has revealed with regards to an-
tecedents and outcomes, in conjunction with the emergence of malleable organizational 
designs that dynamically tune firms to their environments, we can identify a move towards 
digital business ecosystems as the second thematic pattern of DT.",outros,1,,banco,
"Business ecosystems 
are often seen as underpinning the value creation and capture of firms, representing ‘the 
alignment structure of the multilateral set of partners that need to interact in order for a 
focal value proposition to materialize’ (Adner, 2017, p. 42).",outros,1,,banco,
"As they shape firm decisions 
about where and how to compete, business ecosystems are an essential topic for strategy 
(Jacobides et al., 2018).",outros,1,,banco,
"In recent decades, we have seen numerous companies moving 
away from hierarchical integrated supply chains and towards these more fragmented net-
works of strategic partnerships with external entities (Bitran et al., 2007).",inteligencia_artificial,1,,banco,
"However, in the 
course of DT, we contend that through the holistic confluence comprising material, or-
ganizational and further environmental dimensions (El Sawy et al., 2010), so-called digital 
business ecosystems, which in the past were only a topic of interest for IT and software 
industries, are becoming more and more inseparable from regular business ecosystems 
and increasingly relevant across sectors as digital technologies diffuse through industries 
and society.",outros,1,,banco,
"Digital business ecosystems define business environments ‘shaped by a net-
work of interdependencies specifically generated through digital technologies’ (Kopalle 
et al., 2020, pp.",outros,1,,banco,
"A key differential factor that sets digital business ecosystems 
apart is their turbulent nature (El Sawy and Perreira, 2013).",outros,1,,banco,
"In the context of business ecosystems, this turbulence becomes 
 14676486, 2021, 5, Downloaded from https://onlinelibrary.wiley.com/doi/10.1111/joms.12639 by Capes, Wiley Online Library on [30/04/2025].",outros,1,,banco,
"Journal of Management Studies published by Society for the Advancement of Management 
Studies and John Wiley & Sons Ltd
visible especially through the vast number and heterogeneity of interdependent part-
ners that shape competition (e.g., Jacobides et al., 2018), the widespread diffusion and 
adoption of interconnected generative technologies (e.g., Kopalle et al., 2020), and the 
constantly changing customer preferences (e.g., Downes and Nunes, 2013).",outros,1,,banco,
"For instance, we identified that DT is triggered and shaped by a plethora 
of diverse digital technologies and applications, such as blockchain technologies, AI and 
the Internet of Things.",inteligencia_artificial,1,,banco,
"Also, consumers are increasingly embedding technology within 
their daily routines and personal interactions, which has profound implications for their 
demands and expectations towards the offerings of and the communications with firms.",inteligencia_artificial,1,,banco,
"In the outcomes category, we can see, among other things, a 
shift towards connected markets in which the participants are involved in numerous ex-
change networks that are easily formed, grown, and dissolved again.",inteligencia_artificial,1,,banco,
"This can mainly be 
attributed to the ubiquity of the Internet and other related technologies on which these 
networks heavily rely, leading overall to digitally permeated markets.",inteligencia_artificial,1,,banco,
"Due to the increasing turbulence, digital business ecosystems are ‘changing the rules 
of the game in many industries through disruptions of business models’ (Pagani, 2013, 
p. 617).",outros,1,,banco,
"The resulting non-linearity and equifinality may make these 
ecosystems better understood from configurational theory (El Sawy et al., 2010; Meyer 
et al., 1993).",outros,1,,banco,
"As a further result of their turbulent nature, digital business ecosystems also diverge 
from regular business ecosystems with regard to their constituents.",outros,1,,banco,
"Following the defi-
nition of Adner (2017), regular business ecosystems are, characterized by, among other 
things, a set of partners with ‘defined positions and activity flows among them’ (p. 42), 
based on a collectively pursued value proposition.",outros,1,,banco,
"Within digital business ecosystems, 
however, the value propositions pursued can change radically in a short period of time 
(Yoo et al., 2012).",outros,1,,banco,
"Thus, the participants within digital business ecosystems, their posi-
tions, and their roles are subject to constant change.",outros,1,,banco,
"Thus, it is becoming increasingly complex 
to maintain an overview of the value propositions pursued and the participants within 
digital business ecosystems, and to determine their positions and the activity flows among 
them.",inteligencia_artificial,1,,banco,
"A Typology of Perspectives on Digital Transformation
The two aggregated thematic patterns of DT (i.e., towards malleable organizational 
designs and digital business ecosystems) summarize the content of DT, which focuses on 
‘the substance of contemporary organizational change’ (Armenakis and Bedeian, 1999, 
p. 295).",outros,1,,banco,
"Following literature from the field of organizational change (e.g., Pettigrew, 2012; 
Sminia and de Rond, 2012), it is necessary to consider the content in conjunction with 
the context and process dimensions.",outros,1,,banco,
"Traditionally, scholars in the field 
of organizational change distinguished between inner contexts (i.e., structures, corporate 
cultures and political context within firms) and outer contexts (i.e., the social, economic, 
political and competitive environment of a firm) (Pettigrew, 1987).",outros,1,,banco,
"Furthermore, the change towards a 
malleable organizational design is embedded in and driven by digital business ecosystems 
and cannot be considered in isolation from this.",outros,1,,banco,
"The contextual scope can be 
rather narrow if the focus is on the relationship between specific elements from digital 
business ecosystems and particular aspects of the organizational design.",outros,1,,banco,
"(2017) focus in their study on the impact of AI on the nature of work 
and the execution of processes in organizations.",inteligencia_artificial,1,,banco,
"Conversely, the contextual scope can 
be rather broad if the holistic confluence of multiple technological, organizational and 
environmental elements in digital business ecosystems, as well as their interactions with 
organizational design as a whole, is considered.",outros,1,,banco,
"The metaphor of an optical lens (Van de Ven and Hargrave, 
2004), which either ‘zooms in’ and focuses on specific aspects and changes related to 
contextual conditions and outcomes of DT or ‘zooms out’ to observe the phenomenon 
in a broader context, can be used here to describe the contextual scope in relation to digital 
business ecosystems and malleable organizational designs.",outros,1,,banco,
"Journal of Management Studies published by Society for the Advancement of Management 
Studies and John Wiley & Sons Ltd
related to digital business ecosystems and their relation to organizational designs, to being 
‘broad’ in scope and examining both thematic patterns of DT in a more holistic way.",outros,1,,banco,
"When considering this dimension, researchers 
on organizational change typically focus on intra-organizational actors and actions (e.g., 
Armenakis and Bedeian, 1999; Sminia and de Rond, 2012).",outros,1,,banco,
"However, as we discussed 
previously, change processes in the course of DT are driven not only by organizational 
actors, but by a confluence of organizational, technological and environmental forces 
in digital business ecosystems (El Sawy et al., 2010).",outros,1,,banco,
"Some studies in our consideration set put more emphasis on 
change processes driven by developments outside of a firm’s direct area of control, such 
as the increasing diffusion of AI, robotics and the Internet, and described their effect 
on organizational design, without dealing in detail with the intra-organizational change 
involved to bring about these effects (e.g., Evans, 2017).",inteligencia_artificial,1,,banco,
"This dimension can vary along a 
continuum from a ‘weak focus’ to a ‘strong focus’ on intra-organizational change pro-
cesses, depending on the emphasis placed on an organization’s innovation and integra-
tion mechanisms as drivers towards malleable organization designs and digital business 
ecosystems.",outros,1,,banco,
"By juxtaposing the two dimensions of contextual scope and intra-organizational change 
process based on our definitions, a two-by-two typology that delineates four distinct per-
spectives on DT emerges (see Figure 3).",outros,1,,banco,
"These four perspectives are technology impact, 
compartmentalized adaptation, systemic shift and holistic co-evolution.",outros,1,,banco,
"It should be stressed that each and every 
perspective assumes organizational change in association with the widespread diffusion 
of digital technologies.",outros,1,,banco,
"The technology impact perspective on DT combines a weak focus on intra-organizational 
change processes with a narrow contextual scope.",outros,1,,banco,
"(2018) 
describe how the diffusion of the blockchain technology leads to the development of 
new business models across several industries.",inteligencia_artificial,1,,banco,
