text,intent,maturity_score,entities,category,metadata
"The main strength of studies 
that follow this perspective is that they reveal important insights into what is really new 
about digital technologies and innovations, and that they clarify partial contributions to 
 14676486, 2021, 5, Downloaded from https://onlinelibrary.wiley.com/doi/10.1111/joms.12639 by Capes, Wiley Online Library on [30/04/2025].",inteligencia_artificial,1,,banco,
"In the same sense, insights about par-
ticular outcomes – such as increased business process efficiency through the use of AI 
– must be related to potential higher-level spill-overs such as exposure to cyber threats.",inteligencia_artificial,3,,banco,
"In 
general, these studies do not provide insights about how organizations arrive at malleable 
organizational designs but reveal particular forces from digital business ecosystems that 
alter certain parts of organizations.",inteligencia_artificial,1,,banco,
"(2013) describe how online 
and offline retailers can successfully take advantage of developments related to mobile 
and augmented reality technologies to improve their interactions with their customers.",inteligencia_artificial,1,,banco,
"(2017) derive a process model explaining how small and medium-sized 
Figure 3.",inteligencia_artificial,1,,banco,
"Here, we can learn, for instance, 
how organizations evolve in response to particular triggers towards data-driven opera-
tions and decision-making.",outros,1,,banco,
"For 
instance, one might explain the success of a firm in managing change associated with 
a specific technology, while concurrently observing the overall downturn of the firm or 
industry as a whole due to the widespread diffusion of digital technologies across society.",inteligencia_artificial,1,,banco,
"In summary, this perspective provides insights on how firms partially adapt their organi-
zations to specific developments in their digital business ecosystems.",outros,1,,banco,
"The systemic shift perspective on DT is employed by studies that have a weak focus 
on intra-organizational change processes, as with the technology impact perspective, 
but combine it with a rather broad contextual scope.",outros,1,,banco,
"Such work thereby describes how 
conditions within digital business ecosystems interact with organizational designs as a 
whole.",outros,1,,banco,
"Hence, studies following this perspective help us 
to understand the peculiarities and evolutions of digital business ecosystems as a whole 
and their impacts on organizational designs.",outros,1,,banco,
"However, the systemic shift perspective does 
not describe how organizations achieve adaptations to and interactions with their respec-
tive business environments.",outros,1,,banco,
"Finally, the holistic co-evolution perspective on DT combines a strong focus on intra-or-
ganizational change processes with a rather broad contextual scope.",outros,1,,banco,
"Works following this perspective contribute to 
research on DT by yielding insights into how organizations transform their organiza-
tional design in accordance with the surrounding evolving digital business ecosystems.",outros,1,,banco,
"Furthermore, examining DT from such a holistic perspective could come at 
the cost of reduced detail concerning particular elements as, for example, peculiarities 
of specific digital technologies cannot be examined and considered to the same extent as 
with the technology impact perspective.",inteligencia_artificial,1,,banco,
"For instance, a study following the holistic co-evolution 
perspective might illustrate the ‘big picture’ and reveal aspects which seem to be of par-
ticular importance, which could then be combined with a technology impact type study 
in which these aspects are examined in greater detail.",inteligencia_artificial,1,,banco,
"While there are multiple frameworks that differentiate orga-
nizational change in this way, our findings reveal a special connection to the distinction 
between episodic and continuous change (Weick and Quinn, 1999), most notably be-
cause the dynamics of change denotes a common theme in both the aforementioned the-
matic patterns.",outros,1,,banco,
"That is, malleable organizational design places a premium on constant 
adaptation and change in correspondence to the environment (Huang et al., 2017), and 
the digital business ecosystems in which organizations are embedded are characterized 
by their ever-evolving and turbulent nature (El Sawy et al., 2010).",outros,1,,banco,
"Accordingly, to clarify 
boundary conditions to investigate DT from the perspective of organizational change, 
it seems promising to contrast our findings with the characteristics of episodic and con-
tinuous change, particularly with respect to the ‘different metaphors of the organization, 
analytical frameworks, theories of intervention, and roles attributed to change agents’ 
(Poole, 2004, p. 5).",outros,1,,banco,
"First, the extant literature differentiates continuous and episodic change by the respec-
tive metaphor of  the organization.",outros,1,,banco,
"In addition, data-driven operations and decisions might, at the 
very least, mitigate cognitive sources of inertia (Besson and Rowe, 2012).",outros,1,,banco,
"Journal of Management Studies published by Society for the Advancement of Management 
Studies and John Wiley & Sons Ltd
With regard to the analytic framework characteristics (Poole, 2004), episodic change 
literature takes macro-level perspectives and sees change as punctuated by occasional 
external events, affecting internal deep structures and leading to revolutionary change in-
volving replacement to reach a new equilibrium.",outros,1,,banco,
"Continuous change, in contrast, utiliz-
ing micro-level perspectives, focuses more on endless local, smaller adaptations emerging 
from improvisations in internal practice that may aggregate over time (Weick and Quinn, 
1999).",outros,1,,banco,
"Last, when looking at the outcomes, we identi-
fied that practically every sphere of an organization can but not necessarily has to be 
affected, illustrating that firms attempt to achieve or remain fit with the contextual con-
ditions, leading to new socio-organizational configurations (Avgerou, 2001), which may 
require incremental to fundamental adaptations depending on the context.",inteligencia_artificial,1,,banco,
"Having said that, our results 
also indicate that for DT, there might as well be deviations from the regular templates 
of continuous and episodic change (Weick and Quinn, 1999).",inteligencia_artificial,1,,banco,
"This is particularly the 
case due to the new complexity stemming from the increasing interconnectedness of 
various and dispersed actors in digital business ecosystems.",outros,1,,banco,
"In the words of El Sawy and 
Perreira (2013, p. 2), ‘[u]nlike other business environments, digital business ecosystems 
can never be expected to revert to any kind of “equilibrium” after disruptions change 
things; turbulence implies that cause-and-effect may cascade in unpredictable ways to 
alter the structure or health of the ecosystem, or end it entirely’.",outros,1,,banco,
"Thus, while DT is as-
sociated with disruptions, known from episodic change conceptions, these are no longer 
infrequent and do not end in a new era of stability.",outros,1,,banco,
"With regard to the respective intervention theory, episodic change assumes change evolving 
by phases of unfreezing, changing and refreezing in a planned and intentional manner, 
while the continuous perspective follows a freeze, rebalance, unfreeze logic where change 
exists irrespective of intention (Weick and Quinn, 1999).",outros,1,,banco,
"Again, as can be seen in the innovation mechanisms, no matter how incremental 
or fundamental the respective change is, we can diagnose a higher importance of digital 
 14676486, 2021, 5, Downloaded from https://onlinelibrary.wiley.com/doi/10.1111/joms.12639 by Capes, Wiley Online Library on [30/04/2025].",inteligencia_artificial,1,,banco,
"Due to the specific nature of digital technologies (Kallinikos et 
al., 2013), particularly the generativity they induce inside and beyond organizations (Yoo 
et al., 2012), we contend that even episodic phases of DT trigger continuous changes.",outros,1,,banco,
"This is also underscored by the fact that firms are increasingly embedded in and interwo-
ven with digital business ecosystems that are inherently turbulent (El Sawy and Perreira, 
2013).",outros,1,,banco,
"Put differently, in the context of DT, the idea of refreezing, as 
the final step in the schematic Lewinian change processes of episodic change (Weick and 
Quinn, 1999), is challenged and may culminate in a state of constant unfreezing.",outros,1,,banco,
"Finally, concerning the change agent, episodic change assumes a change agent that needs 
to radically alter mind-sets within the organization to create change (Weick and Quinn, 
1999).",outros,1,,banco,
"However, again, when we look at the outcomes of DT and the higher level of 
flexibility the malleable organizational design implies, we see change agents following the 
continuous paradigm as a new constant.",inteligencia_artificial,1,,banco,
"Though, especially in the beginning of DT and 
due to the unpredictable evolution of digital business ecosystems in later phases, change 
agents from the perspective of episodic change will also be necessary.",outros,1,,banco,
"What is unique to DT and going 
beyond the boundaries of established perspectives on organizational change is that, due 
to the traits of digital technologies underlying the new organizational design and digi-
tal business ecosystems, even these episodic episodes lead to new phases of continuous 
change in organizations, which may endure for a comparably long time.",inteligencia_artificial,1,,banco,
"This path profits from the established the-
oretical models as a robust basis from which to better understand and explain the phe-
nomenon.",inteligencia_artificial,1,,banco,
"Our review revealed that conceptions of 
continuous change are generally suitable, with some constraints.",inteligencia_artificial,1,,banco,
"We, therefore, discuss 
in the following how theories that are classified as belonging to the continuous change 
 14676486, 2021, 5, Downloaded from https://onlinelibrary.wiley.com/doi/10.1111/joms.12639 by Capes, Wiley Online Library on [30/04/2025].",outros,1,,banco,
"Furthermore, theories that combine elements of both continuous 
and episodic change (Poole, 2004) seem particularly valuable.",outros,1,,banco,
"First, while we 
find that continuous change perspectives generally fit the phenomenon of DT well, we 
also identified some variations in this fit, particularly with regard to taking into account 
the actions of external actors, and when also employing macro perspectives.",outros,1,,banco,
"Second, 
while we strongly associate DT with a shift towards continuous change, we also con-
cluded that this shift might be triggered and shaped by episodic bursts.",outros,1,,banco,
"Episodic change 
perspectives might thus be valuable, with the adaption of not assuming an end-state 
or freezing period.",outros,1,,banco,
"It is important to note that a detailed review of each 
of the aforementioned theories is beyond the scope of this study, although the analysis 
of their basic tenets in the light of DT generates valuable stimulants for future research.",inteligencia_artificial,1,,banco,
"When employing the DT perspective of technology impact, continuous theories of insti-
tutional diffusion (Van de Ven and Hargrave, 2004) might be very helpful.",outros,1,,banco,
"Furthermore, technology structuration theories (Orlikowski, 2000) might be valu-
able for tracing the consequences of interactions with digital technologies in relation 
to organizational change.",outros,1,,banco,
"For instance, heterogeneous and dispersed external software devel-
opers have been found to alter the value creation structures of focal companies (Parker 
et al., 2017), while other consequences concerning organizational change remain unex-
plored.",inteligencia_artificial,1,,banco,
"However, when using such lenses, it is important to 
incorporate the specific traits of digital technologies.",inteligencia_artificial,1,,banco,
"Here, creative accumulation theory (Bergek et al., 2013) seems very promis-
ing as it allows revolutionary and evolutionary technology consequences to be explained, 
and thereby reconciles thoughts from both the episodic and the continuous perspectives.",inteligencia_artificial,1,,banco,
"Research agenda
DT perspective
Phenomenological advancement
Theoretical advancement
Technology impact
•	 How do emerging digital technologies (e.g., distributed ledger 
technologies, virtual and augmented reality, quantum comput-
ing or AI) influence particular elements of inter- and intra-
organizational structuring?",inteligencia_artificial,1,,banco,
"[Creative 
accumulation theory]
•	 How can we explain if and how practices of external 
actors (such as developers or consumers) alter organiza-
tional structures on the basis of shared digital technolo-
gies using technology structuration theory?",inteligencia_artificial,1,,banco,
"How do implica-
tions for organizational change shift?",outros,1,,banco,
"Compart-mentalized 
adaptation
•	 How can trainings help existing organizational members to 
learn new digital behaviors and utilize new digital technology?",inteligencia_artificial,1,,banco,
"[Interpersonal interaction and socialization theory]
•	 Is training and socialization possible and adequate for 
digital natives and new digital talent in the course of DT?",inteligencia_artificial,1,,banco,
"[Interpersonal interaction and socialization theory]
•	 Can socialization be programmed into robots and AI-based 
systems?",inteligencia_artificial,1,,banco,
"•	 How can we extend punctuated equilibrium theory to 
account for continuous adaptive organizations in turbu-
lent digital business ecosystems that do not stabilize after 
disruptions?",outros,1,,banco,
"•	 How do we need to adapt our understanding of 
dynamic capabilities when ordinary and dynamic capa-
bilities merge due to the increased use of flexible and 
reprogrammable digital technologies?",outros,1,,banco,
"Journal of Management Studies published by Society for the Advancement of Management 
Studies and John Wiley & Sons Ltd
DT perspective
Phenomenological advancement
Theoretical advancement
Systemic shift
•	 How do new digital organizational forms (such as platform-en-
abled peer-to-peer networks) emerge and become institution-
alized across contexts?",outros,1,,banco,
"[Population and community ecology theory]
•	 Over time, can we observe more homogeneity in organiza-
tional forms through the interactions of initially heterogeneous 
players within digital business ecosystems?",outros,1,,banco,
"•	 How do we need to adapt our understanding of collec-
tive action to capture the specifics of turbulent digital 
business ecosystems?",outros,1,,banco,
"Holistic co-evolution
•	 How do internal change initiatives (e.g., by institutional entre-
preneurs) of particular organizations radiate throughout digital 
business ecosystems and shape their gestalt?",outros,1,,banco,
"[Culture change theory]
•	 How do changes in digital business ecosystems alter power 
relations (e.g., between different functions or units) and value 
commitments inside of firms?",outros,1,,banco,
"[Neo-institutional theory]
•	 How and why can conflicting views, both inside organiza-
tions and within digital business ecosystems, be reconciled?",outros,1,,banco,
"•	 How do well-known relationships between institutional 
upheaval and organizational change hold when organi-
zational design becomes malleable in the course of DT?",outros,1,,banco,
"•	 How does organizational change in association with DT af-
fect employee satisfaction, commitment and organizational 
identification?",outros,1,,banco,
"•	 How can new theories, inductively derived in the con-
text of DT, explain organizational change?",inteligencia_artificial,1,,banco,
"•	 Can we explain DT using the motors of change 
typology?",inteligencia_artificial,1,,banco,
"It is also interesting to investigate how such theoretical relations play 
out when new actors are non-human, such as robots or AI-based systems.",inteligencia_artificial,1,,banco,
"In a similar 
vein, one might ask if theories relating to organizational learning (Vera et al., 2011) need 
to be adapted to the new realities of DT, where learning is more and more data-driven, 
potentially automatized and tuned to the external environment.",outros,1,,banco,
"Thus, while data-driven 
operations have the potential to detect and correct errors independently (so-called ‘single 
loop learning’), with the rise of AI, this might also radiate to higher levels of learning.",inteligencia_artificial,1,,banco,
"This data-based automation and AI might 
question human agency in organizational learning.",inteligencia_artificial,4,,banco,
"Relatedly, questions regarding the 
idea of dynamic capabilities (Teece, 1997) arise.",outros,1,,banco,
"As for the particular dynamic nature of these digital 
operational capabilities (Kallinikos et al., 2013), the difference between ordinary and 
dynamic capabilities might vanish, as capabilities based on digital technology are very 
easily adaptable.",outros,1,,banco,
"Future research might investigate whether DT leads to the seemingly 
contradictory result that firms adapt faster than ever on the basis of flexible ordinary 
capabilities, while the need for dynamic capabilities in the traditional sense shrinks.",outros,1,,banco,
"When employing the DT perspective of systemic shift, continuous views from popu-
lation and community ecologies (Baum and Rao, 2004) seem adequate for investigat-
ing how new digital organizational forms (Hinings et al., 2018) emerge and become 
institutionalized across fields and ecosystems.",outros,1,,banco,
"Furthermore, theories of collective action (Van de Ven and Hargrave, 2004) 
seem promising given the importance of digital business ecosystems.",outros,1,,banco,
"However, future 
research should scrutinize necessary adaptations because collective action is no longer a 
punctual event, but a constant, never-ending process in digital business ecosystems which 
involves ever-changing groups of actors.",outros,1,,banco,
"When employing the DT perspective of holistic co-evolution, theories of institutional 
design (Van de Ven and Hargrave, 2004) can be very helpful for learning how organiza-
tional actions and actors are interacting with the surrounding digital business ecosystem.",outros,1,,banco,
"For instance, the internal change processes of an organization from a pipeline towards a 
platform company may significantly shape and be shaped by the business environments, 
partner networks, etc.",outros,1,,banco,
"Furthermore, using the lens of culture 
change (Hatch, 2004), future research should investigate how the increasing embedded-
ness in global, cross-industry and large scale digital business ecosystems involving intense 
and ongoing interactions with heterogeneous actors (Yoo et al., 2012) leads to dynam-
ics in organizational culture.",outros,1,,banco,
"Here, it seems interesting to see if strong cultures can serve as a connective 
tissue holding the dynamics of malleable organizational designs and turbulent digital 
business ecosystems together (Weick and Quinn, 1999).",outros,1,,banco,
"First, in the spirit of Armenakis and 
Bedeian (1999), it is important to assess certain criterion variables, such as performance 
and employee satisfaction, to investigate the efficacy of change efforts.",inteligencia_artificial,1,,banco,
"As our analysis has revealed, while 
certain accounts seem to fit DI well, others should be adapted.",inteligencia_artificial,1,,banco,
"Furthermore, 
our analysis of the organizational change literature was tightly coupled to the distinction 
of episodic vs. continuous change.",outros,1,,banco,
"Journal of Management Studies published by Society for the Advancement of Management 
Studies and John Wiley & Sons Ltd
DT, for instance with regard to synthesizing divergent interests both within organizations 
and digital business ecosystems.",outros,1,,banco,
"Furthermore, the process of coding 
the articles was performed by hand, and so could be subject to subjectivity, although we 
aimed to prevent this by relying on multiple coders and several rounds of scrutinizing 
the coding.",inteligencia_artificial,1,,banco,
"Fourth, 
regarding the discussion, we based our thoughts on the episodic vs. continuous change 
distinction, as we identified its value for understanding DT.",outros,1,,banco,
"Managerial Implications
Next to the aforementioned implications for research, this study also provides valuable 
insights into managerial practice with respect to organizational change and strategy.",outros,1,,banco,
"We can witness this phenomenon for example in the 
current COVID-19 pandemic that simultaneously highlights the potential as well as the 
necessity of malleable organizational designs: regulatory measures to contain the spread 
of the virus such as lockdowns and limited person-to-person contacts are forcing new 
digital ways of collaboration (e.g., through tools such as Zoom or Slack), service delivery 
models (e.g., through the adoption of AI and robotic process automation), and customer 
relationship management (e.g., through harnessing digital channels) (KMPG, 2020; 
McKinsey, 2020; strategy&, 2020).",inteligencia_artificial,4,,banco,
"Hence, the ideas and topics related to DT such as automatized, data-driven and virtual 
business processes or ecosystem-oriented and embedded organizations are not simply 
academic, but of high relevance in practice as well since they provide insights into key 
questions of organizational change and strategy such as how to adapt organizations, 
 14676486, 2021, 5, Downloaded from https://onlinelibrary.wiley.com/doi/10.1111/joms.12639 by Capes, Wiley Online Library on [30/04/2025].",outros,1,,banco,
"As we pointed out, DT involves, on the one hand a shift toward malleable organizational 
designs that enable continuous adaptation and on the other, toward turbulent digital 
business ecosystems.",outros,1,,banco,
"To account 
for this complexity in assessing the contextual conditions, managers should pro-actively 
use support from data-analytics.",outros,1,,banco,
"Current and future DT studies on technology impact and 
systemic shift are best suited to informing DT awareness.",outros,1,,banco,
"This refers to the intellectual 
capacity to continuously conceive novel digital processes and products based on the avail-
able internal and external resources, as well as the willingness to invest both managerial 
attention and financial resources in times of episodic bursts.",inteligencia_artificial,1,,banco,
"Above all, it is important to 
understand that fast execution and experimentation to learn in the market are superior 
to ex-ante planning and analysis due to the dynamic nature of digital business ecosystems 
and the transience of competitive positions and advantages.",outros,1,,banco,
"This skill can be informed 
and further developed with studies in the realm of holistic co-evolution.",outros,1,,banco,
"Third, managers require DT harmonizing skills with regards to organizational change 
processes.",outros,1,,banco,
"These are again related to the mechanisms in the multi-dimensional frame-
work, but with a focus on integration.",inteligencia_artificial,1,,banco,
"We propose that those firms which ensure that the 
aforementioned three leadership skills are present and sustained in their organization are 
best prepared to master the challenges of DT.",inteligencia_artificial,1,,banco,
"At the same time, however, there 
still exist considerable uncertainties about what DT is and encompasses.",inteligencia_artificial,1,,banco,
"As a result, build-
ing on prior knowledge on organizational change to better understand the phenomenon 
and give informed advice to practice is problematic.",outros,1,,banco,
"We define 
DT as organizational change triggered and shaped by the widespread diffusion of digital 
technology.",outros,1,,banco,
"The content of this change, we find, comprises a move towards malleable or-
ganizational designs that are embedded in and driven by digital business ecosystems.",outros,1,,banco,
"This 
content of change can be viewed from four different perspectives, including a technology 
impact, compartmentalized adaptation, systemic shift and holistic co-evolution perspective.",outros,1,,banco,
"The perspectives vary in their contextual scope and focus on intra-organizational change 
processes but share the commonality that they associate organizational change with the na-
ture of digital technologies, particularly their pervasiveness and the dynamics they induce.",outros,1,,banco,
"Linking our findings to the established knowledge on organizational change, we diagnose 
that DT can be best understood as continuous change that can be triggered and shaped by 
episodic bursts, while the latter are inducing further continuous change.",outros,1,,banco,
"Through this boundary clarification, an agenda for future research as well 
as important managerial implications for strategy and organizational change arise.",outros,1,,banco,
"‘Organizational change: A review of theory and research in the 
1990s’.",outros,1,,banco,
‘The significance of context in information systems and organizational change’.,outros,1,,banco,
"), Handbook of  Organizational Change and Innovation.",outros,1,,banco,
"‘Special section: The transformative value 
of cloud computing: A decoupling, platformization, and recombination theoretical framework’.",infraestrutura_digital,4,,banco,
