text,intent,maturity_score,entities,category,metadata
‘A contingency model for creating value from RFDI supply chain,inteligencia_artificial,1,,banco,
‘Building dynamic capabilities for digital transformation: An ongoing,outros,1,,banco,
"(Eds), Handbook of  Organizational Change and Innovation",outros,1,,banco,
"(Given the large number of  references for the research matrix, the article does not provide detailed references of  all papers",inteligencia_artificial,1,,banco,
referencing is available from the authors upon request),inteligencia_artificial,1,,banco,
